Zeitstempel,Name Firma,Ansprechpartner,Branch,Email,Telefon,Fax,"Strasse, Hausnummer","PLZ, Ort",Webseite,Instagram Link,Facebook Link,Webshop Link,Beschreibung,Bestellung über:,Lieferung & Bezahlung,Logo Link,Video Link,PDF Link,Rechtliches,Mobile,Öffnungszeiten,,Bestellung über:
27.03.2020 15:49:58,Staehlin GmbH,das Staehlin Team,Dekoration / Geschenke,janne.hain@staehlin.de,0831-521700,,Klostersteige 12-14,Kempten,www.staehlin.de,https://www.instagram.com/staehlin_1855/,https://www.facebook.com/StaehlinKempten,,"Aktuelle „Öffnungszeiten“ bzw. Bürozeiten sind Montag bis Freitag von 8-17 Uhr
Bürowelt 🖊💻🖨
Produkte sind im Onlineshop (www.staehlin.de) dargestellt, es kann per E-Mail (buerowelt@staehlin.de), telefonisch (0831-5216032) oder direkt über den Onlineshop bestellt werden!

Papeterie✂️🖌🖍
Gerne können Kunden Bestellungen mit genauer Artikelbezeichnung oder Fotos aufgeben und eine Beratung per Telefon/ E-Mail in Anspruch nehmen! Gerne werden auch Schullisten zusammengestellt und an Kunden verschickt! Viele Schulranzen, Rucksäcke, Schulmaterialien oder auch Künstler- und Bastelbedarfe sind auf Lager!
E-Mail: papeterie@staehlin.de, Telefon: 0831-521700

Einrichtungskultur🛋
Projektanfragen, Angebote, Bestellungen werden gerne entgegen genommen!
E-Mail: einrichtungskultur@staehlin.de, Telefon: 0831-5217045

Kostenlose Lieferung ab einem Bestellwert von 49,00 €.
Wir freuen uns über jede Bestellung!
","Telefon, Email, Internetseite, Facebook, Instagram","Bezahlung: Vorkasse/auf Rechnung, Lieferung: wir liefern Ihnen die Ware kontaktlos oder Sie können die Ware kontaktlos bei uns abholen",/unternehmen/staehlin.jpg,,,"Ich bestätige hiermit, dass meine Angaben korrekt sind und ich der Eigentümer, des anzuzeigenden Unternehmens bin., Ich stimme zu, dass meine Daten auf der Webseite tante-hilde.org veröffentlicht werden.",,Montag - Freitag 8- 17 Uhr,,
27.03.2020 15:54:06,Wildfräulein - Lodenkleidung für Berg und Tal,Sabine Manteuffel,Bekleidung / Accessoires,info@wildfraeulein.de,08334-3187017,,Nußbaumstr. 9,87730  Bad Grönenbach,www.wildfraeulein.de,https://www.instagram.com/wildfraeulein_lodenkleidung,https://www.facebook.com/wildfraeulein/,https://www.wildfraeulein.de/,"Handgefertigt: Lieblingsstücke aus Walk und Loden. Regional und besonders nachhaltig fertigen wir unsere Produkte direkt hier im Allgäu. Jacken, Westen, tolle Mode für Berg und Tal. Einfach im Onlineshop bestellen oder auch gerne anrufen, ich berate euch sehr gerne!","Telefon, Email, Whatsapp, Internetseite, Facebook, Instagram","Ganz normal per DHL, Bezahlung per PayPal oder Überweisung. Mobil über SumUp Kartenzahlung ebenfalls möglich.",/unternehmen/LogoWildfraeulein.png,,,"Ich bestätige hiermit, dass meine Angaben korrekt sind und ich der Eigentümer, des anzuzeigenden Unternehmens bin., Ich stimme zu, dass meine Daten auf der Webseite tante-hilde.org veröffentlicht werden.",,"Mo-Fr 10-12, 14-17 Uhr, Mittwochnachm. geschlossen,  Sa 10-13 Uhr ",,
27.03.2020 16:02:57,"Zweirad Lämmle GmbH & Co, KG",Julia Lämmle,Sport,info@zweirad-laemmle.de,083347217,,Ittelsburger Straße 11,87730 Bad Grönenbach,www.zweirad-laemmle.de,https://www.instagram.com/zweirad_laemmle.de/,https://www.facebook.com/zweiradlaemmle,www.zweirad-laemmle.de,"Onlineshop, Viele tolle Angebote auf unserer Internetseite, 0% Finanzierung, Lieferung bis 25km kostenfrei, Werkstattservice","Telefon, Email, Internetseite","Überweisung, Finanzierung, Paypal, Sofort Überweisung",https://www.zweirad-laemmle.de/img/logo.png,https://www.youtube.com/watch?v=zxpnP1ZlczI,https://www.zweirad-laemmle.de/serviceleistungen.asp,"Ich bestätige hiermit, dass meine Angaben korrekt sind und ich der Eigentümer, des anzuzeigenden Unternehmens bin., Ich stimme zu, dass meine Daten auf der Webseite tante-hilde.org veröffentlicht werden.",,10.00-12.00-13.00-16.00,,
27.03.2020 16:04:37,Laufsport Saukel,Joachim Saukel,Sport,joachim@laufsport-saukel.de,0831 201218,,Kronenstr. 12,87435 Kempten,www.laufsport-saukel.de,https://www.instagram.com/laufsportsaukel/,https://www.facebook.com/laufsportsaukel/,"https://www.laufsport-saukel.de/OnlineShop/tabid/159/List/1/Default.aspx?SortField=ProductName,ProductName",Wir liefern versandkostenfrei. In Kempten und im Altlandkreis noch am gleichen Tag wenn die Bestellung bis 14:00 Uhr bei uns eingeht. Wir beraten auch via skype,"Telefon, Email, Internetseite, Facebook, Instagram, skype skypename: joachimsaukel",Rechnung,/unternehmen/saukel.png,/videos/saukel.mp4,,"Ich bestätige hiermit, dass meine Angaben korrekt sind und ich der Eigentümer, des anzuzeigenden Unternehmens bin., Ich stimme zu, dass meine Daten auf der Webseite tante-hilde.org veröffentlicht werden.",,Im Normalfall Mo - Fr 9:30 bis 18:00 Uhr und am Samstag 9:30 Uhr bis 16:00 Uhr,,
27.03.2020 16:31:44,obacht  - das Allgäuer Familienmagazin,Manuela Subba,,info@obacht-magazin.de,08331 7569301,no,Kempter Straße 6,87700 Memmingen,www.obacht-magazin.de,https://www.instagram.com/obacht_familienmagazin/,https://www.facebook.com/obachtfamilienmagazin/,www.obacht-magazin.de,"Das obacht Familienmagazin kann abonniert werden. 6 Ausgaben = 1 Jahr Lieferung frei Haus: 21,00 Euro. Das Abo endet nach einem Jahr und verlängert sich nicht automatisch.","Telefon, Email",Die Rechnungstellung erfolgt mit der Lieferung der ersten Ausgabe.,/unternehmen/obacht.png,,,"Ich bestätige hiermit, dass meine Angaben korrekt sind und ich der Eigentümer, des anzuzeigenden Unternehmens bin., Ich stimme zu, dass meine Daten auf der Webseite tante-hilde.org veröffentlicht werden.",08331 7569301,no,,
27.03.2020 17:05:49,Primel Naturwaren,Waltraud Vogel,Bekleidung / Accessoires,info@primel.de,08372/7662 und 08372-2535,,Im Schlattes 16,87496 Untrasried,www.primel.de,,,,"Unser Versand läuft wie bisher weiter. Sie erhalten bei uns Naturtextilien und Naturwaren die konsequent ökologisch, sozialverträglich und nachhaltig produziert sind. In erster Linie Baby-Ausstattung und eine große Auswahl an natürlicher, schadstofffreier Kleidung für Babys und Kinder, aber auch einige Accessoires für die Großen, natürliche Unterwäsche für die ganze Familie, sowie Bettwaren und viele andere sinnvolle Produkte. Gerne senden wir Ihnen unseren kostenlosen Katalog zu und beraten Sie auch gerne telefonisch! ","Telefon, Email, Internetseite","Wir liefern blitzschnell! Bestellungen bis 12.00 Uhr werden auf Wunsch am gleichen Tag verschickt - Lieferung mit DHL. Bezahlung per Rechnung, Sepa-Lastschrift oder Vorauskasse.",/unternehmen/Primel_Logo.png,,https://www.primel.de/UserFiles/Media/primel-katalog-2019-2020.pdf,"Ich bestätige hiermit, dass meine Angaben korrekt sind und ich der Eigentümer, des anzuzeigenden Unternehmens bin., Ich stimme zu, dass meine Daten auf der Webseite tante-hilde.org veröffentlicht werden.",0151-59837045,Mo - Fr. 9.00 - 12.00 / Do. 16.00 - 18.30 / Fr. 15.00 - 18.30 Uhr,,
27.03.2020 18:10:11,Restaurant Mylord ,Anna Musto ,Gastronomie,Annare26@gmx.de,0831/28374,,Kotternerstrasse 72,87435 kempten,,,,,Zur Zeit nur Abholung ,Telefon,,/unternehmen/mylord.png,,,"Ich bestätige hiermit, dass meine Angaben korrekt sind und ich der Eigentümer, des anzuzeigenden Unternehmens bin., Ich stimme zu, dass meine Daten auf der Webseite tante-hilde.org veröffentlicht werden.",,11:30-14:00 und 17:30-21:00,,
27.03.2020 18:23:43,Siegfried Liebherr e.K. ,Julia Liebherr ,Sicherheit,julia@s-liebherr.de,0831 71778,083172665,Rosenauberg 1,87437 Kempten,www.s-liebherr.de,https://www.instagram.com/siegfriedliebherr/?r=nametag,https://m.facebook.com/Siegfried.Liebherr,,"Beratungen und Infos gerne über Telefon, Email oder WhatsApp. Lieferungen bis auf weiteres innerhalb Kemptens kostenlos ","Telefon, Email, Whatsapp, Fax, Internetseite, Facebook, Instagram","Lieferung innerhalb Kempten kostenfrei, Bezahlung bar, EC/Kreditkarte ",/unternehmen/liebher-schluessel.jpg,,,"Ich bestätige hiermit, dass meine Angaben korrekt sind und ich der Eigentümer, des anzuzeigenden Unternehmens bin., Ich stimme zu, dass meine Daten auf der Webseite tante-hilde.org veröffentlicht werden.",+4915141217169,"Mo-Fr 8-17 Uhr, Samstag vorübergehend geschlossen",,
27.03.2020 18:38:40,Kara Brew Bar,Miriam Kasoglu ,Gastronomie,miriam@der-gaukler.com,,,Sankt Mang Platz 23,87435 Kempten,,,,,Gerne verschicken wir euch Gutscheine.,"Whatsapp, Facebook, Instagram",Überweisung oder Paypal,/unternehmen/kara-brew-bar.jpg,,,"Ich bestätige hiermit, dass meine Angaben korrekt sind und ich der Eigentümer, des anzuzeigenden Unternehmens bin., Ich stimme zu, dass meine Daten auf der Webseite tante-hilde.org veröffentlicht werden.",015116920629,"Mittwoch-Sonntag 10-18 Uhr, Freitag 10-20 Uhr",,
27.03.2020 18:55:33,Allgäuer Ölmühle e.K.,Lucia Krohmer ,Lebensmittel,lk@gutes.bio,0831960986-16,,Heisinger Straße 45,87437 Kempten ,www.allgaeuer-oelmuehle.de,,,https://www.xn--allguer-lmhle-efb8yod.de/,Schaut gerne in unserem Online-Shop vorbei! Dort bekommt ihr alle Infos! ,"Telefon, Email, Internetseite",,/unternehmen/allgaeuer-oelmuehle.png,,,"Ich bestätige hiermit, dass meine Angaben korrekt sind und ich der Eigentümer, des anzuzeigenden Unternehmens bin., Ich stimme zu, dass meine Daten auf der Webseite tante-hilde.org veröffentlicht werden.",,,,
27.03.2020 21:15:16,Berg & Kristall,Leon von Below,Schmuck /Optik,kontakt@berg-und-kristall.de,,,Parkstraße 15,87439 Kempten,www.berg-und-kristall.de,,,www.berg-und-kristall.de,Entdecke markante Rohsteine und schönen Schmuck im Mineralienverkauf auf www.berg-und-kristall.de,"Email, Internetseite",Eine Bezahlung ist mit Kreditkarte oder mit Überweisung als Vorkasse möglich. Die Ware verschicke ich anschließend mit der Post.,https://static.wixstatic.com/media/e68ad9_3523fae989794890a1f261dbd6546550~mv2.jpg,https://video.wixstatic.com/video/e68ad9_9a3671fac41340319e76694efa555ecb/1080p/mp4/file.mp4,,"Ich bestätige hiermit, dass meine Angaben korrekt sind und ich der Eigentümer, des anzuzeigenden Unternehmens bin., Ich stimme zu, dass meine Daten auf der Webseite tante-hilde.org veröffentlicht werden.",,,,